URL,Employer,Name,Salary,From,To,City
https://hh.ru/vacancy/108545392,Сборщик онлайн-заказов (график выходного дня),Перекрёсток,True,639000.0,732600.0,Одинцово (Московская область)
https://hh.ru/vacancy/107911883,"Сборщик заказов (Москва, Ленинградский, 31А)",Перекрёсток,True,1395000.0,1611000.0,Москва
https://hh.ru/vacancy/107912750,"Сборщик заказов (Москва, Боровское, 46)",Перекрёсток,True,1395000.0,1611000.0,Москва
https://hh.ru/vacancy/108166705,"Сборщик заказов (Ростов-на-Дону, Зорге, 33)",Перекрёсток,True,964800.0,1134000.0,Ростов-на-Дону
https://hh.ru/vacancy/107912034,"Сборщик заказов (Балашиха, Железнодорожный, Юбилейная, 6)",Перекрёсток,True,1395000.0,1611000.0,Железнодорожный  (Московская область)
https://hh.ru/vacancy/108596236,"Сборщик заказов (Нижний Новгород, Казанское, 4А)",Перекрёсток,True,928800.0,1098000.0,Нижний Новгород
https://hh.ru/vacancy/108389911,"Сборщик заказов (Кисловодск, Победы, 6)",Перекрёсток,True,964800.0,1134000.0,Кисловодск
https://hh.ru/vacancy/108495466,"Сборщик заказов (Москва, Земляной Вал, 33)",Перекрёсток,True,1395000.0,1611000.0,Москва
https://hh.ru/vacancy/107911626,"Сборщик заказов (Москва, Фестивальная, 2Б)",Перекрёсток,True,1395000.0,1611000.0,Москва
https://hh.ru/vacancy/107911644,"Сборщик заказов (Москва, Максимова, 5)",Перекрёсток,True,1395000.0,1611000.0,Москва
https://hh.ru/vacancy/108495411,"Сборщик заказов (Москва, Хорошёвское, 70)",Перекрёсток,True,1395000.0,1611000.0,Москва
https://hh.ru/vacancy/108495578,"Сборщик заказов (Москва, Бакинская, 17)",Перекрёсток,True,1395000.0,1611000.0,Москва
https://hh.ru/vacancy/109469404,Сборщик онлайн-заказов (график выходного дня),Перекрёсток,True,639000.0,732600.0,Москва
https://hh.ru/vacancy/108495892,"Сборщик заказов (Подольск, Машиностроителей, 22)",Перекрёсток,True,1395000.0,1611000.0,Подольск (Московская область)
https://hh.ru/vacancy/107912482,"Сборщик заказов (Нижний Новгород, Романтиков, 19)",Перекрёсток,True,928800.0,1098000.0,Нижний Новгород
https://hh.ru/vacancy/107913237,"Сборщик заказов (Москва, Большая Семёновская, 16)",Перекрёсток,True,1395000.0,1611000.0,Москва
https://hh.ru/vacancy/108596636,"Сборщик заказов (Пенза, Суворова, 144А)",Перекрёсток,True,964800.0,1134000.0,Пенза
https://hh.ru/vacancy/107912192,"Сборщик заказов (Москва, Хорошёвское, 27)",Перекрёсток,True,1395000.0,1611000.0,Москва
https://hh.ru/vacancy/108495701,"Сборщик заказов (Москва, Нежинская, 6)",Перекрёсток,True,1395000.0,1611000.0,Москва
https://hh.ru/vacancy/109475568,Сборщик онлайн-заказов,Перекрёсток,True,639000.0,732600.0,Москва
https://hh.ru/vacancy/108032681,"Сборщик заказов (Ростов-на-Дону, Красноармейская, 105)",Перекрёсток,True,964800.0,1134000.0,Ростов-на-Дону
https://hh.ru/vacancy/109238454,"Сборщик заказов (пр-т Чекистов, 36 ""ТЦ Пять Звёзд"")",Перекрёсток,True,990000.0,1134000.0,Краснодар
https://hh.ru/vacancy/108495321,"Сборщик заказов (Сочи, Кирова, 58)",Перекрёсток,True,1330200.0,1531800.0,Сочи
https://hh.ru/vacancy/107912964,"Сборщик заказов (Москва, Дмитровское, 89)",Перекрёсток,True,1395000.0,1611000.0,Москва
https://hh.ru/vacancy/108495291,"Сборщик заказов (Екатеринбург, Машинистов, 1)",Перекрёсток,True,1062000.0,1229400.0,Екатеринбург
https://hh.ru/vacancy/108495591,"Сборщик заказов (Краснодар, Душистая, 54Б)",Перекрёсток,True,964800.0,1134000.0,Краснодар
https://hh.ru/vacancy/108495950,"Сборщик заказов (Москва, Новочерёмушкинская, 26)",Перекрёсток,True,1395000.0,1611000.0,Москва
https://hh.ru/vacancy/108845130,"Сборщик заказов (Санкт-Петербург, Комендантский, 33)",Перекрёсток,True,1157400.0,1341000.0,Санкт-Петербург
https://hh.ru/vacancy/108931255,"Сборщик заказов (Санкт-Петербург, Шлиссельбургский, 17)",Перекрёсток,True,1157400.0,1341000.0,Санкт-Петербург
https://hh.ru/vacancy/104574505,Сборщик заказов (сотрудник супермаркета),Перекрёсток,True,844200.0,990000.0,Нижний Новгород
https://hh.ru/vacancy/107913103,"Сборщик заказов (Екатеринбург, Викулова, 57А)",Перекрёсток,True,1062000.0,1229400.0,Екатеринбург
https://hh.ru/vacancy/108390224,"Сборщик заказов (Строитель, 5 Августа, 11)",Перекрёсток,True,630000.0,756000.0,Строитель (Белгородская область)
https://hh.ru/vacancy/107911571,"Сборщик заказов (Москва, Андропова, 36)",Перекрёсток,True,1395000.0,1611000.0,Москва
https://hh.ru/vacancy/109470126,Сборщик онлайн-заказов (график выходного дня),Перекрёсток,True,639000.0,732600.0,Москва
https://hh.ru/vacancy/109271507,"Сборщик заказов (Чехов, Симферопольское, 1)",Перекрёсток,True,1285200.0,1501200.0,Чехов (Московская область)
https://hh.ru/vacancy/107913601,"Сборщик заказов (Москва, Мурановская, 15А)",Перекрёсток,True,1395000.0,1611000.0,Москва
https://hh.ru/vacancy/107911521,"Сборщик заказов (Санкт-Петербург, Кременчугская, 11)",Перекрёсток,True,1157400.0,1341000.0,Санкт-Петербург
https://hh.ru/vacancy/109271789,"Сборщик заказов (Балашиха, Заречная, 45)",Перекрёсток,True,540000.0,900000.0,Балашиха (Московская область)
https://hh.ru/vacancy/107913018,"Сборщик заказов (Москва, Алтуфьевское, 95)",Перекрёсток,True,1395000.0,1611000.0,Москва
https://hh.ru/vacancy/108166297,"Сборщик заказов (Москва, Вешняковская, 18)",Перекрёсток,True,1395000.0,1611000.0,Москва
https://hh.ru/vacancy/108032670,"Сборщик заказов (Самара, Московское, 81А)",Перекрёсток,True,964800.0,1134000.0,Самара
https://hh.ru/vacancy/107913541,"Сборщик заказов (Москва, Шереметьевская, 6)",Перекрёсток,True,1395000.0,1611000.0,Москва
https://hh.ru/vacancy/107912198,"Сборщик заказов (Москва, Можайское, 31)",Перекрёсток,True,1395000.0,1611000.0,Москва
https://hh.ru/vacancy/108718112,"Сборщик заказов (Балашиха, Ольгино, Граничная, 24)",Перекрёсток,True,1395000.0,1611000.0,Балашиха (Московская область)
https://hh.ru/vacancy/108495317,"Сборщик заказов (Санкт-Петербург, Маршала Блюхера, 41)",Перекрёсток,True,1157400.0,1341000.0,Санкт-Петербург
https://hh.ru/vacancy/109470689,Сборщик онлайн-заказов (график выходного дня),Перекрёсток,True,639000.0,732600.0,Москва
https://hh.ru/vacancy/108596384,"Сборщик заказов (Балашиха, Зеленая, 32)",Перекрёсток,True,1395000.0,1611000.0,Балашиха (Московская область)
https://hh.ru/vacancy/109442611,"Сборщик заказов (Балашиха, Звездная, 8)",Перекрёсток,True,1395000.0,1611000.0,Балашиха (Московская область)
https://hh.ru/vacancy/108596343,"Сборщик заказов (Красногорск, Ленина, 2)",Перекрёсток,True,1395000.0,1611000.0,Красногорск (Московская область)
https://hh.ru/vacancy/109271314,"Сборщик заказов (Наро-Фоминск, Киевское)",Перекрёсток,True,1395000.0,1611000.0,Наро-Фоминск (Московская область)
https://hh.ru/vacancy/108596642,"Сборщик заказов (Москва, Римского-Корсакова, 20)",Перекрёсток,True,1395000.0,1611000.0,Москва
https://hh.ru/vacancy/108032708,"Сборщик заказов (Москва, 2-я Филевская, 14)",Перекрёсток,True,1395000.0,1611000.0,Москва
https://hh.ru/vacancy/108496030,"Сборщик заказов (Москва, Первомайская, 42)",Перекрёсток,True,1395000.0,1611000.0,Москва
https://hh.ru/vacancy/108495491,"Сборщик заказов (Москва, Академика Янгеля, 8А)",Перекрёсток,True,1395000.0,1611000.0,Москва
https://hh.ru/vacancy/108596315,"Сборщик заказов (Москва, Генерала Белобородова, 14)",Перекрёсток,True,1395000.0,1611000.0,Москва
https://hh.ru/vacancy/108596519,"Сборщик заказов (Краснодар, Восточно-Кругликовская, 42/3)",Перекрёсток,True,964800.0,1134000.0,Краснодар
https://hh.ru/vacancy/108495544,"Сборщик заказов (Санкт-Петербург, Свердловская, 60)",Перекрёсток,True,1157400.0,1341000.0,Санкт-Петербург
https://hh.ru/vacancy/109473407,Сборщик онлайн-заказов (график выходного дня),Перекрёсток,True,639000.0,732600.0,Москва
https://hh.ru/vacancy/107913133,"Сборщик заказов (Москва, Перерва, 43)",Перекрёсток,True,1395000.0,1611000.0,Москва
https://hh.ru/vacancy/107912870,"Сборщик заказов (Москва, Матвеевская, 2)",Перекрёсток,True,1395000.0,1611000.0,Москва
https://hh.ru/vacancy/108495320,"Сборщик заказов (Порошкино, Порошкино, Дорога на Мендсары, 10)",Перекрёсток,True,1157400.0,1341000.0,посёлок имени Морозова
https://hh.ru/vacancy/108596396,"Сборщик заказов (Московский, Солнечная, 3)",Перекрёсток,True,1395000.0,1611000.0,Москва
https://hh.ru/vacancy/108596407,"Сборщик заказов (Москва, Череповецкая, 17)",Перекрёсток,True,1395000.0,1611000.0,Москва
https://hh.ru/vacancy/109469206,Сборщик онлайн-заказов (график выходного дня),Перекрёсток,True,639000.0,732600.0,Москва
https://hh.ru/vacancy/107913690,"Сборщик заказов (Раменское, Донинское, 16)",Перекрёсток,True,1395000.0,1611000.0,Раменское (Московская область)
https://hh.ru/vacancy/108931612,"Сборщик заказов (Липецк, Московская, 103)",Перекрёсток,True,964800.0,1134000.0,Липецк
https://hh.ru/vacancy/107911355,"Сборщик заказов (Нижний Новгород, Большая Покровская, 82)",Перекрёсток,True,928800.0,1098000.0,Нижний Новгород
https://hh.ru/vacancy/107911730,"Сборщик заказов (Москва, Керамический, 51)",Перекрёсток,True,1395000.0,1611000.0,Москва
https://hh.ru/vacancy/107912878,"Сборщик заказов (Дзержинск, Циолковского, 61)",Перекрёсток,True,916200.0,1085400.0,Дзержинск (Нижегородская область)
https://hh.ru/vacancy/108495294,"Сборщик заказов (Санкт-Петербург, Лиговский, 153)",Перекрёсток,True,1157400.0,1341000.0,Санкт-Петербург
https://hh.ru/vacancy/107911906,"Сборщик заказов (Москва, Таллинская, 7)",Перекрёсток,True,1395000.0,1611000.0,Москва
https://hh.ru/vacancy/109271506,"Сборщик заказов (Москва, Омская, 7А)",Перекрёсток,True,1395000.0,1611000.0,Москва
https://hh.ru/vacancy/107913331,"Сборщик заказов (Краснодар, им. Атарбекова, 1/1)",Перекрёсток,True,964800.0,1134000.0,Краснодар
https://hh.ru/vacancy/107912944,"Сборщик заказов (Москва, Воротынская, 18)",Перекрёсток,True,1395000.0,1611000.0,Москва
https://hh.ru/vacancy/107912987,"Сборщик заказов (Москва, Новопетровская, 6)",Перекрёсток,True,1395000.0,1611000.0,Москва
https://hh.ru/vacancy/108596145,"Сборщик заказов (Таганрог, Гоголевский, 2/2)",Перекрёсток,True,964800.0,1134000.0,Таганрог
https://hh.ru/vacancy/108496121,"Сборщик заказов (Ставрополь, Тухачевского, 29)",Перекрёсток,True,964800.0,1134000.0,Ставрополь
https://hh.ru/vacancy/108496138,"Сборщик заказов (Москва, Совхозная, 8)",Перекрёсток,True,1395000.0,1611000.0,Москва
https://hh.ru/vacancy/107911679,"Сборщик заказов (Москва, Онежская, 20)",Перекрёсток,True,1395000.0,1611000.0,Москва
https://hh.ru/vacancy/109271898,"Сборщик заказов (Подольск, Профсоюзная, 1Б)",Перекрёсток,True,1440000.0,1620000.0,Подольск (Московская область)
https://hh.ru/vacancy/107912951,"Сборщик заказов (Москва, Ладожская, 13)",Перекрёсток,True,1395000.0,1611000.0,Москва
https://hh.ru/vacancy/108545631,Сборщик онлайн-заказов (график выходного дня),Перекрёсток,True,639000.0,732600.0,Москва
https://hh.ru/vacancy/107912734,"Сборщик заказов (Видное, Лопатино, Сухановская, 1)",Перекрёсток,True,1395000.0,1611000.0,Видное (Московская область)
https://hh.ru/vacancy/107913087,"Сборщик заказов (Санкт-Петербург, Маршала Блюхера, 9)",Перекрёсток,True,1157400.0,1341000.0,Санкт-Петербург
https://hh.ru/vacancy/107911669,"Сборщик заказов (Москва, Минская, 14А)",Перекрёсток,True,1395000.0,1611000.0,Москва
https://hh.ru/vacancy/107913506,"Сборщик заказов (Сосновый Бор, Красных Фортов, 26)",Перекрёсток,True,1157400.0,1341000.0,Сосновый Бор (Ленинградская область)
https://hh.ru/vacancy/108596245,"Сборщик заказов (Мытищи, Мира, 32/2)",Перекрёсток,True,1395000.0,1611000.0,Мытищи (Московская область)
https://hh.ru/vacancy/108636385,Сборщик онлайн-заказов (график выходного дня),Перекрёсток,True,482400.0,567000.0,Краснодар
https://hh.ru/vacancy/109116715,"Сборщик заказов (Липецк, Героя России Эдуарда Белана)",Перекрёсток,True,450000.0,720000.0,Липецк
https://hh.ru/vacancy/107913077,"Сборщик заказов (Новороссийск, Дзержинского, 211)",Перекрёсток,True,934200.0,1103400.0,Новороссийск
https://hh.ru/vacancy/108930383,"Сборщик заказов (Санкт-Петербург, Кондратьевский, 44)",Перекрёсток,True,1157400.0,1341000.0,Санкт-Петербург
https://hh.ru/vacancy/108931890,"Сборщик заказов (Королёв, Лесная, 12)",Перекрёсток,True,1080000.0,1800000.0,Королев (Московская область)
https://hh.ru/vacancy/109442939,"Сборщик заказов (Домодедово, Южный, Курыжова, 5А)",Перекрёсток,True,1395000.0,1611000.0,Домодедово (Московская область)
https://hh.ru/vacancy/108495901,"Сборщик заказов (Химки, Транспортный, 9)",Перекрёсток,True,1395000.0,1611000.0,Химки (Московская область)
https://hh.ru/vacancy/108496151,"Сборщик заказов (Москва, Шмитовский, 16)",Перекрёсток,True,1395000.0,1611000.0,Москва
https://hh.ru/vacancy/109271520,"Сборщик заказов (Рязань, Введенская, 115)",Перекрёсток,True,1121400.0,1339200.0,Рязань
https://hh.ru/vacancy/107912197,"Сборщик заказов (Москва, Краснодарская, 51)",Перекрёсток,True,1395000.0,1611000.0,Москва
https://hh.ru/vacancy/107911614,"Сборщик заказов (Балашиха, Железнодорожный, Пролетарская, 2)",Перекрёсток,True,1395000.0,1611000.0,Железнодорожный  (Московская область)
https://hh.ru/vacancy/108718237,"Сборщик заказов (Москва, Фрязевская, 3)",Перекрёсток,True,1395000.0,1611000.0,Москва
https://hh.ru/vacancy/107911855,"Сборщик заказов (Москва, Паперника, 9)",Перекрёсток,True,1395000.0,1611000.0,Москва
https://hh.ru/vacancy/107912143,"Сборщик заказов (Екатеринбург, Малышева, 53)",Перекрёсток,True,1062000.0,1229400.0,Екатеринбург
https://hh.ru/vacancy/107913461,"Сборщик заказов (Санкт-Петербург, Дачный, 9К)",Перекрёсток,True,1157400.0,1341000.0,Санкт-Петербург
https://hh.ru/vacancy/108166444,"Сборщик заказов (Самара, Ново-Садовая, 305)",Перекрёсток,True,1108941.0,1303419.0,Самара
https://hh.ru/vacancy/108717957,"Сборщик заказов (Колпино, Трудящихся, 12)",Перекрёсток,True,1157400.0,1341000.0,Колпино
https://hh.ru/vacancy/108931891,"Сборщик заказов (Калуга, Суворова, 113)",Перекрёсток,True,810000.0,1080000.0,Калуга
https://hh.ru/vacancy/107913253,"Сборщик заказов (Реутов, Южная, 10)",Перекрёсток,True,1395000.0,1611000.0,Реутов (Московская область)
https://hh.ru/vacancy/108495302,"Сборщик заказов (Санкт-Петербург, Кораблестроителей, 21)",Перекрёсток,True,720000.0,1080000.0,Санкт-Петербург
https://hh.ru/vacancy/107913441,"Сборщик заказов (Москва, Малая Филёвская, 13)",Перекрёсток,True,1395000.0,1611000.0,Москва
https://hh.ru/vacancy/107911765,"Сборщик заказов (Воронеж, Героев Сибиряков, 65А)",Перекрёсток,True,964800.0,1134000.0,Воронеж
https://hh.ru/vacancy/108495330,"Сборщик заказов (Мытищи, Олимпийский, 10)",Перекрёсток,True,1395000.0,1611000.0,Мытищи (Московская область)
https://hh.ru/vacancy/108496181,"Сборщик заказов (Москва, Балаклавский, 5А)",Перекрёсток,True,1395000.0,1611000.0,Москва
https://hh.ru/vacancy/108166695,"Сборщик заказов (Тула, Калужское, 1)",Перекрёсток,True,1121400.0,1339200.0,Тула
https://hh.ru/vacancy/108845150,"Сборщик заказов (Курск, Кулакова, 20)",Перекрёсток,True,540000.0,594000.0,Курск
https://hh.ru/vacancy/108845343,"Сборщик заказов (Мытищи, Лётная, 40А)",Перекрёсток,True,680400.0,1440000.0,Мытищи (Московская область)
https://hh.ru/vacancy/108166616,"Сборщик заказов (Мытищи, Мира, 30)",Перекрёсток,True,1395000.0,1611000.0,Мытищи (Московская область)
https://hh.ru/vacancy/108496206,"Сборщик заказов (Краснодар, Кореновская, 10)",Перекрёсток,True,964800.0,1134000.0,Краснодар
https://hh.ru/vacancy/108596053,"Сборщик заказов (Тюмень, Московский тракт, 118)",Перекрёсток,True,959400.0,1126800.0,Тюмень
https://hh.ru/vacancy/108390120,"Сборщик заказов (Москва, Кибальчича, 12)",Перекрёсток,True,1395000.0,1611000.0,Москва
https://hh.ru/vacancy/108545824,Сборщик онлайн-заказов (график выходного дня),Перекрёсток,True,639000.0,732600.0,Москва
https://hh.ru/vacancy/108166719,"Сборщик заказов (Выборг, Победы, 16)",Перекрёсток,True,1157400.0,1341000.0,Выборг
https://hh.ru/vacancy/108495807,"Сборщик заказов (Москва, Вавилова, 66)",Перекрёсток,True,1395000.0,1611000.0,Москва
https://hh.ru/vacancy/107913507,"Сборщик заказов (Москва, Голубинская, 28)",Перекрёсток,True,1395000.0,1611000.0,Москва
https://hh.ru/vacancy/109137023,Сборщик заказов,Перекрёсток,True,990000.0,1260000.0,Ростов-на-Дону
https://hh.ru/vacancy/108718226,"Сборщик заказов (Саранск, Советская, 55А)",Перекрёсток,True,540000.0,720000.0,Саранск
https://hh.ru/vacancy/107912924,"Сборщик заказов (Люберцы, Октябрьский, 366)",Перекрёсток,True,1395000.0,1611000.0,Люберцы  (Московская область)
https://hh.ru/vacancy/108255718,"Сборщик заказов (Москва, Лобненская, 4А)",Перекрёсток,True,1395000.0,1611000.0,Москва
https://hh.ru/vacancy/109472879,Сборщик онлайн-заказов (график выходного дня),Перекрёсток,True,639000.0,732600.0,Москва
https://hh.ru/vacancy/107912890,"Сборщик заказов (Москва, Тимирязевская, 2/3)",Перекрёсток,True,1395000.0,1611000.0,Москва
https://hh.ru/vacancy/108032705,"Сборщик заказов (Тюмень, Пермякова, 50Б)",Перекрёсток,True,959400.0,1126800.0,Тюмень
https://hh.ru/vacancy/108495370,"Сборщик заказов (Ногинск, 3-го Интернационала, 62)",Перекрёсток,True,1395000.0,1611000.0,Ногинск (Московская область)
https://hh.ru/vacancy/109271758,"Сборщик заказов (Видное, Солнечный, 10)",Перекрёсток,True,1395000.0,1611000.0,Видное (Московская область)
https://hh.ru/vacancy/108166320,"Сборщик заказов (Москва, Измайловское, 71)",Перекрёсток,True,1395000.0,1611000.0,Москва
https://hh.ru/vacancy/108166266,"Сборщик заказов (Московский, Никитина, 2)",Перекрёсток,True,1395000.0,1611000.0,Москва
https://hh.ru/vacancy/108495486,"Сборщик заказов (Москва, Заревый, 14/12)",Перекрёсток,True,1395000.0,1611000.0,Москва
https://hh.ru/vacancy/108495976,"Сборщик заказов (Москва, Коровий Вал, 1)",Перекрёсток,True,1395000.0,1611000.0,Москва
https://hh.ru/vacancy/108545165,Сборщик онлайн-заказов (график выходного дня),Перекрёсток,True,639000.0,732600.0,Зеленоград
https://hh.ru/vacancy/107912200,"Сборщик заказов (Санкт-Петербург, Стачек, 7)",Перекрёсток,True,1157400.0,1341000.0,Санкт-Петербург
https://hh.ru/vacancy/107912994,"Сборщик заказов (Москва, Варшавское, 124)",Перекрёсток,True,1395000.0,1611000.0,Москва
https://hh.ru/vacancy/108845137,"Сборщик заказов (Санкт-Петербург, Планерная, 59)",Перекрёсток,True,1157400.0,1341000.0,Санкт-Петербург
https://hh.ru/vacancy/109271784,"Сборщик заказов (Воронеж, 20-летия Октября, 90)",Перекрёсток,True,540000.0,576000.0,Воронеж
https://hh.ru/vacancy/109469997,Сборщик онлайн-заказов (график выходного дня),Перекрёсток,True,639000.0,732600.0,Москва
