URL,Employer,Name,Salary,From,To,City
https://hh.ru/vacancy/107912403,"Сборщик заказов (Красногорск, Авангардная, 3)",Перекрёсток,True,1395000.0,1611000.0,Красногорск (Московская область)
https://hh.ru/vacancy/108496058,"Сборщик заказов (Москва, Востряковский, 17А)",Перекрёсток,True,1395000.0,1611000.0,Москва
https://hh.ru/vacancy/109271708,"Сборщик заказов (Ульяновск, Жигулевская, 9)",Перекрёсток,True,964800.0,1134000.0,Ульяновск
https://hh.ru/vacancy/108495786,"Сборщик заказов (Москва, Театральная, 3)",Перекрёсток,True,1395000.0,1611000.0,Москва
https://hh.ru/vacancy/108718188,"Сборщик заказов (Самара, Белорусская, 131)",Перекрёсток,True,720000.0,810000.0,Самара
https://hh.ru/vacancy/107911740,"Сборщик заказов (Казань, Ибрагимова, 56)",Перекрёсток,True,928800.0,1098000.0,Казань
https://hh.ru/vacancy/108496000,"Сборщик заказов (Санкт-Петербург, Ленская, 12)",Перекрёсток,True,1157400.0,1341000.0,Санкт-Петербург
https://hh.ru/vacancy/108718171,"Сборщик заказов (Москва, Пришвина, 22)",Перекрёсток,True,720000.0,1080000.0,Москва
https://hh.ru/vacancy/107912808,"Сборщик заказов (Москва, Мира, 33)",Перекрёсток,True,1395000.0,1611000.0,Москва
https://hh.ru/vacancy/108496111,"Сборщик заказов (Москва, Борисовские Пруды, 26)",Перекрёсток,True,1395000.0,1611000.0,Москва
https://hh.ru/vacancy/109271470,"Сборщик заказов (Екатеринбург, Блюхера, 39)",Перекрёсток,True,1080000.0,1440000.0,Екатеринбург
https://hh.ru/vacancy/108495693,"Сборщик заказов (Ульяновск, Ульяновский, 14)",Перекрёсток,True,964800.0,1134000.0,Ульяновск
https://hh.ru/vacancy/108495296,"Сборщик заказов (Екатеринбург, Радищева, 33)",Перекрёсток,True,1062000.0,1229400.0,Екатеринбург
https://hh.ru/vacancy/107912073,"Сборщик заказов (Санкт-Петербург, Морская, 35)",Перекрёсток,True,1157400.0,1341000.0,Санкт-Петербург
https://hh.ru/vacancy/108495315,"Сборщик заказов (Санкт-Петербург, Савушкина, 116)",Перекрёсток,True,1157400.0,1341000.0,Санкт-Петербург
https://hh.ru/vacancy/108718083,"Сборщик заказов (Колпино, Тверская, 58/6)",Перекрёсток,True,1157400.0,1341000.0,Колпино
https://hh.ru/vacancy/109271648,"Сборщик заказов (Нижний Новгород, Карла Маркса, 7А)",Перекрёсток,True,928800.0,1098000.0,Нижний Новгород
https://hh.ru/vacancy/109116559,"Сборщик заказов (Королёв, Космонавтов, 12А)",Перекрёсток,True,630000.0,1170000.0,Королев (Московская область)
https://hh.ru/vacancy/107912053,"Сборщик заказов (Москва, Нагатинская, 16)",Перекрёсток,True,1395000.0,1611000.0,Москва
https://hh.ru/vacancy/107912794,"Сборщик заказов (Ломоносов, Федюнинского, 16)",Перекрёсток,True,1157400.0,1341000.0,Ломоносов
https://hh.ru/vacancy/108931733,"Сборщик заказов (Санкт-Петербург, Энергетиков, 70)",Перекрёсток,True,1157400.0,1341000.0,Санкт-Петербург
https://hh.ru/vacancy/108845109,"Сборщик заказов (Санкт-Петербург, Репищева, 13)",Перекрёсток,True,1157400.0,1341000.0,Санкт-Петербург
https://hh.ru/vacancy/107912781,"Сборщик заказов (Сочи, Ленина, 298Б)",Перекрёсток,True,1330200.0,1531800.0,Сочи
https://hh.ru/vacancy/108931889,"Сборщик заказов (Москва, Ярославское, 12)",Перекрёсток,True,1386000.0,1584000.0,Москва
https://hh.ru/vacancy/109271573,"Сборщик заказов (Тольятти, Дзержинского, 21)",Перекрёсток,True,964800.0,1134000.0,Тольятти
https://hh.ru/vacancy/108845361,"Сборщик заказов (Ижевск, 10 лет Октября, 53)",Перекрёсток,True,720000.0,1080000.0,Ижевск
https://hh.ru/vacancy/108718199,"Сборщик заказов (Нижнекамск, Химиков, 18)",Перекрёсток,True,540000.0,810000.0,Нижнекамск
https://hh.ru/vacancy/107913016,"Сборщик заказов (Санкт-Петербург, Кронверкская, 5)",Перекрёсток,True,1157400.0,1341000.0,Санкт-Петербург
https://hh.ru/vacancy/108166186,"Сборщик заказов (Москва, Корнея Чуковского, 2)",Перекрёсток,True,1395000.0,1611000.0,Москва
https://hh.ru/vacancy/108845346,"Сборщик заказов (Москва, Космонавта Волкова, 6А)",Перекрёсток,True,1395000.0,1611000.0,Москва
https://hh.ru/vacancy/108931834,"Сборщик заказов (Москва, Протопоповский, 3)",Перекрёсток,True,1080000.0,1440000.0,Москва
https://hh.ru/vacancy/109116442,"Сборщик заказов (Зеленоград, , 406)",Перекрёсток,True,1395000.0,1611000.0,Москва
https://hh.ru/vacancy/108596288,"Сборщик заказов (Зеленоград, , 900)",Перекрёсток,True,1170000.0,2160000.0,Москва
https://hh.ru/vacancy/108596523,"Сборщик заказов (Москва, Адмирала Лазарева, 2)",Перекрёсток,True,1395000.0,1611000.0,Москва
https://hh.ru/vacancy/108496152,"Сборщик заказов (Москва, Большая Новодмитровская, 23)",Перекрёсток,True,1395000.0,1611000.0,Москва
https://hh.ru/vacancy/107913323,"Сборщик заказов (Москва, Варшавское, 26)",Перекрёсток,True,1395000.0,1611000.0,Москва
https://hh.ru/vacancy/109271671,"Сборщик заказов (Люберцы, Октябрьский, 112)",Перекрёсток,True,1395000.0,1611000.0,Люберцы  (Московская область)
https://hh.ru/vacancy/108596229,"Сборщик заказов (Екатеринбург, Щербакова, 4)",Перекрёсток,True,1062000.0,1229400.0,Екатеринбург
https://hh.ru/vacancy/107913152,"Сборщик заказов (Набережные Челны, Яшьлек, 14)",Перекрёсток,True,1000800.0,1168200.0,Набережные Челны
https://hh.ru/vacancy/107913676,"Сборщик заказов (Москва, Киевского Вокзала, 2)",Перекрёсток,True,878400.0,1364400.0,Москва
https://hh.ru/vacancy/108845281,"Сборщик заказов (Ижевск, им Петрова, 29)",Перекрёсток,True,810000.0,1080000.0,Ижевск
https://hh.ru/vacancy/108718127,"Сборщик заказов (Москва, Грина, 7)",Перекрёсток,True,1395000.0,1611000.0,Москва
https://hh.ru/vacancy/108718192,"Сборщик заказов (Липецк, Имени К.Е. Ворошилова, 4)",Перекрёсток,True,964800.0,1134000.0,Липецк
https://hh.ru/vacancy/109116619,"Сборщик заказов (Самара, Рабочая, 15)",Перекрёсток,True,720000.0,900000.0,Самара
https://hh.ru/vacancy/109271902,"Сборщик заказов (Санкт-Петербург, Славянка, п Шушары, Ростовская, 20)",Перекрёсток,True,900000.0,1080000.0,Санкт-Петербург
https://hh.ru/vacancy/109271868,"Сборщик заказов (Мытищи, Новомытищинский, 49)",Перекрёсток,True,1260000.0,1440000.0,Мытищи (Московская область)
https://hh.ru/vacancy/107913472,"Сборщик заказов (Ростов-на-Дону, Стачки, 25)",Перекрёсток,True,964800.0,1134000.0,Ростов-на-Дону
https://hh.ru/vacancy/108495776,"Сборщик заказов (Тюмень, Уездная, 4)",Перекрёсток,True,1102734.0,1295143.0,Тюмень
https://hh.ru/vacancy/108390053,"Сборщик заказов (Москва, Мира, 188Б)",Перекрёсток,True,1395000.0,1611000.0,Москва
https://hh.ru/vacancy/109271804,"Сборщик заказов (Санкт-Петербург, Шушары, Новгородский, 6)",Перекрёсток,True,1157400.0,1341000.0,Шушары
https://hh.ru/vacancy/108596181,"Сборщик заказов (Анапа, Омелькова, 38)",Перекрёсток,True,934200.0,1103400.0,Анапа
https://hh.ru/vacancy/107912137,"Сборщик заказов (Санкт-Петербург, Щербакова, 7)",Перекрёсток,True,1157400.0,1341000.0,Санкт-Петербург
https://hh.ru/vacancy/107912216,"Сборщик заказов (Москва, Шоссейная, 49)",Перекрёсток,True,1395000.0,1611000.0,Москва
https://hh.ru/vacancy/109271780,"Сборщик заказов (Мытищи, Селезнева, 33)",Перекрёсток,True,1395000.0,1611000.0,Мытищи (Московская область)
https://hh.ru/vacancy/107912233,"Сборщик заказов (Санкт-Петербург, Наставников, 33)",Перекрёсток,True,1157400.0,1341000.0,Санкт-Петербург
https://hh.ru/vacancy/108496051,"Сборщик заказов (Москва, Широкая, 9)",Перекрёсток,True,684000.0,792000.0,Москва
https://hh.ru/vacancy/108931641,"Сборщик заказов (Москва, Волочаевская, 12А)",Перекрёсток,True,1395000.0,1611000.0,Москва
https://hh.ru/vacancy/108495738,"Сборщик заказов (Воронеж, Московский, 189/6)",Перекрёсток,True,964800.0,1134000.0,Воронеж
https://hh.ru/vacancy/108845373,"Сборщик заказов (Липецк, П.И.Смородина, 13А)",Перекрёсток,True,684000.0,810000.0,Липецк
https://hh.ru/vacancy/109442709,"Сборщик заказов (Москва, Перервинский, 4)",Перекрёсток,True,1080000.0,1440000.0,Москва
https://hh.ru/vacancy/107913260,"Сборщик заказов (Екатеринбург, Сулимова, 26)",Перекрёсток,True,1062000.0,1229400.0,Екатеринбург
https://hh.ru/vacancy/108166679,"Сборщик заказов (Липецк, Ленина, 5)",Перекрёсток,True,964800.0,1134000.0,Липецк
https://hh.ru/vacancy/107912314,"Сборщик заказов (Кингисепп, Октябрьская, 9)",Перекрёсток,True,1157400.0,1341000.0,Кингисепп
https://hh.ru/vacancy/108166693,"Сборщик заказов (Тобольск, 7а, 30)",Перекрёсток,True,937800.0,1107000.0,Тобольск
https://hh.ru/vacancy/107912111,"Сборщик заказов (Санкт-Петербург, Наставников, 35)",Перекрёсток,True,1157400.0,1341000.0,Санкт-Петербург
https://hh.ru/vacancy/108166361,"Сборщик заказов (Москва, Хабаровская, 15)",Перекрёсток,True,1395000.0,1611000.0,Москва
https://hh.ru/vacancy/108495423,"Сборщик заказов (Москва, Румянцево, 1)",Перекрёсток,True,1395000.0,1611000.0,Москва
https://hh.ru/vacancy/108718240,"Сборщик заказов (Санкт-Петербург, Испытателей, 27)",Перекрёсток,True,1157400.0,1341000.0,Санкт-Петербург
https://hh.ru/vacancy/109116564,"Сборщик заказов (Самара, Тухачевского, 233)",Перекрёсток,True,720000.0,1080000.0,Самара
https://hh.ru/vacancy/107912037,"Сборщик заказов (Москва, Онежская, 34)",Перекрёсток,True,1395000.0,1611000.0,Москва
https://hh.ru/vacancy/108931784,"Сборщик заказов (Москва, Борисовский, 3)",Перекрёсток,True,1395000.0,1611000.0,Москва
https://hh.ru/vacancy/107912193,"Сборщик заказов (Санкт-Петербург, Левашовский, 13)",Перекрёсток,True,1157400.0,1341000.0,Санкт-Петербург
https://hh.ru/vacancy/107913630,"Сборщик заказов (Москва, Щёлковское, 75)",Перекрёсток,True,1395000.0,1611000.0,Москва
https://hh.ru/vacancy/108032549,"Сборщик заказов (Москва, Новомарьинская, 14/15)",Перекрёсток,True,1260000.0,1620000.0,Москва
https://hh.ru/vacancy/108495484,"Сборщик заказов (Сестрорецк, Володарского, 2)",Перекрёсток,True,1157400.0,1341000.0,Сестрорецк
https://hh.ru/vacancy/108845301,"Сборщик заказов (Москва, Саянская, 8А)",Перекрёсток,True,1350000.0,2070000.0,Москва
https://hh.ru/vacancy/107912651,"Сборщик заказов (Апатиты, Козлова, 10)",Перекрёсток,True,1339200.0,1508400.0,Апатиты
https://hh.ru/vacancy/108845366,"Сборщик заказов (Щербинка, Железнодорожная, 44)",Перекрёсток,True,1080000.0,1530000.0,Москва
https://hh.ru/vacancy/107913535,"Сборщик заказов (Пермь, Уральская, 85)",Перекрёсток,True,937800.0,1107000.0,Пермь
https://hh.ru/vacancy/107912875,"Сборщик заказов (Санкт-Петербург, Большевиков, 32)",Перекрёсток,True,1157400.0,1341000.0,Санкт-Петербург
https://hh.ru/vacancy/108844933,"Сборщик заказов (Воронеж, Средне-Московская, 32Б)",Перекрёсток,True,964800.0,1134000.0,Воронеж
https://hh.ru/vacancy/109212811,"Сборщик заказов (Москва, Мичуринский, 44А)",Перекрёсток,True,1395000.0,1611000.0,Москва
https://hh.ru/vacancy/107913679,"Сборщик заказов (Ханты-Мансийск, Мира, 45)",Перекрёсток,True,1166400.0,1335600.0,Ханты-Мансийск
https://hh.ru/vacancy/108718144,"Сборщик заказов (Санкт-Петербург, Кораблестроителей, 31)",Перекрёсток,True,1157400.0,1341000.0,Санкт-Петербург
https://hh.ru/vacancy/108495978,"Сборщик заказов (Пермь, Уинская, 15А)",Перекрёсток,True,937800.0,1107000.0,Пермь
https://hh.ru/vacancy/109271740,"Сборщик заказов (Самара, Аэродромная, 13)",Перекрёсток,True,964800.0,1134000.0,Самара
https://hh.ru/vacancy/107913628,"Сборщик заказов (Зеленоград, , 1446)",Перекрёсток,True,1395000.0,1611000.0,Москва
https://hh.ru/vacancy/107912370,"Сборщик заказов (Москва, Рязанский, 30)",Перекрёсток,True,1395000.0,1611000.0,Москва
https://hh.ru/vacancy/108166707,"Сборщик заказов (Санкт-Петербург, Лыжный, 6)",Перекрёсток,True,1157400.0,1341000.0,Санкт-Петербург
https://hh.ru/vacancy/108718043,"Сборщик заказов (Москва, Паустовского, 6)",Перекрёсток,True,1395000.0,1611000.0,Москва
https://hh.ru/vacancy/108845277,"Сборщик заказов (Москва, Волгоградский, 1)",Перекрёсток,True,1080000.0,1620000.0,Москва
https://hh.ru/vacancy/109271422,"Сборщик заказов (Самара, Солнечная, 60/126)",Перекрёсток,True,964800.0,1134000.0,Самара
https://hh.ru/vacancy/108596124,"Сборщик заказов (Сургут, 30 лет Победы, 46)",Перекрёсток,True,1166400.0,1335600.0,Сургут
https://hh.ru/vacancy/107912387,"Сборщик заказов (Санкт-Петербург, Думская, 4А)",Перекрёсток,True,1157400.0,1341000.0,Санкт-Петербург
https://hh.ru/vacancy/108596270,"Сборщик заказов (Ижевск, Холмогорова, 11)",Перекрёсток,True,972000.0,1141200.0,Ижевск
https://hh.ru/vacancy/109116688,"Сборщик заказов (Москва, Стромынка, 25)",Перекрёсток,True,1350000.0,1800000.0,Москва
https://hh.ru/vacancy/109271793,"Сборщик заказов (Москва, Дыбенко, 7/1)",Перекрёсток,True,1026000.0,1206000.0,Москва
https://hh.ru/vacancy/108596101,"Сборщик заказов (Нижний Новгород, Мещерский, 10Б)",Перекрёсток,True,928800.0,1098000.0,Нижний Новгород
https://hh.ru/vacancy/108495527,"Сборщик заказов (Санкт-Петербург, Пятилеток, 2)",Перекрёсток,True,1157400.0,1341000.0,Санкт-Петербург
https://hh.ru/vacancy/108931787,"Сборщик заказов (Москва, Зеленодольская, 40)",Перекрёсток,True,1395000.0,1611000.0,Москва
https://hh.ru/vacancy/107913025,"Сборщик заказов (Санкт-Петербург, Коллонтай, 30)",Перекрёсток,True,1157400.0,1341000.0,Санкт-Петербург
https://hh.ru/vacancy/108255656,"Сборщик заказов (Санкт-Петербург, Славянка, п Шушары, Ростовская, 20)",Перекрёсток,True,810000.0,1080000.0,Санкт-Петербург
https://hh.ru/vacancy/100105580,Сборщик заказов (сотрудник супермаркета),Перекрёсток,False,,,Самара
https://hh.ru/vacancy/109271881,"Сборщик заказов (Москва, Ж/к Дубровка, Сосновая, 6)",Перекрёсток,True,1170000.0,1350000.0,Москва
https://hh.ru/vacancy/107911520,"Сборщик заказов (Казань, Победы, 50Б)",Перекрёсток,True,928800.0,1098000.0,Казань
https://hh.ru/vacancy/108495288,"Сборщик заказов (Санкт-Петербург, Аптекарский, 18)",Перекрёсток,True,1157400.0,1341000.0,Санкт-Петербург
https://hh.ru/vacancy/109212759,"Сборщик заказов (Москва, Вешняковская, 22)",Перекрёсток,True,1395000.0,1611000.0,Москва
https://hh.ru/vacancy/107912272,"Сборщик заказов (Самара, Солнечная, 24)",Перекрёсток,True,964800.0,1134000.0,Самара
https://hh.ru/vacancy/108596424,"Сборщик заказов (Самара, Ново-Садовая, 160М)",Перекрёсток,True,964800.0,1134000.0,Самара
https://hh.ru/vacancy/107913096,"Сборщик заказов (Москва, Причальный, 8)",Перекрёсток,True,1224000.0,1476000.0,Москва
https://hh.ru/vacancy/108011897,"Сборщик заказов (Москва, Андропова, 8)",Перекрёсток,True,1278000.0,1465200.0,Москва
https://hh.ru/vacancy/107912680,"Сборщик заказов (Москва, Ленинградский, 37Б)",Перекрёсток,True,1278000.0,1465200.0,Москва
https://hh.ru/vacancy/109116605,"Сборщик заказов (Москва, Кронштадтский, 3А)",Перекрёсток,True,1350000.0,1800000.0,Москва
https://hh.ru/vacancy/108495413,"Сборщик заказов (Щербинка, Новостроевская, 6)",Перекрёсток,True,1395000.0,1611000.0,Москва
https://hh.ru/vacancy/107911321,"Сборщик заказов (Санкт-Петербург, Тихая, 3)",Перекрёсток,True,1157400.0,1341000.0,Санкт-Петербург
https://hh.ru/vacancy/108495589,"Сборщик заказов (Геленджик, Халтурина, 30)",Перекрёсток,True,934200.0,1103400.0,Геленджик
https://hh.ru/vacancy/107912349,"Сборщик заказов (Одинцово, Маршала Крылова, 21)",Перекрёсток,True,1395000.0,1611000.0,Одинцово (Московская область)
https://hh.ru/vacancy/109442650,"Сборщик заказов (Москва, Сухонская, 9А)",Перекрёсток,True,1350000.0,1800000.0,Москва
https://hh.ru/vacancy/107911709,"Сборщик заказов (Москва, Дмитровское, 73)",Перекрёсток,True,1395000.0,1611000.0,Москва
https://hh.ru/vacancy/107912014,"Сборщик заказов (Екатеринбург, 8 Марта, 149)",Перекрёсток,True,1062000.0,1229400.0,Екатеринбург
https://hh.ru/vacancy/108596398,"Сборщик заказов (Екатеринбург, Татищева, 20)",Перекрёсток,True,993600.0,1162800.0,Екатеринбург
https://hh.ru/vacancy/107911822,"Сборщик заказов (Москва, Осенний, 12)",Перекрёсток,True,1395000.0,1611000.0,Москва
https://hh.ru/vacancy/108011757,"Сборщик заказов (Москва, Шоссейная, 49)",Перекрёсток,True,1278000.0,1465200.0,Москва
https://hh.ru/vacancy/108845207,"Сборщик заказов (Москва, Новоясеневский, 7)",Перекрёсток,True,1395000.0,1611000.0,Москва
https://hh.ru/vacancy/107913407,"Сборщик заказов (Москва, Борисовские Пруды, 10)",Перекрёсток,True,1395000.0,1611000.0,Москва
https://hh.ru/vacancy/108364248,Сборщик заказов (сотрудник супермаркета),Перекрёсток,False,,,Тула
https://hh.ru/vacancy/109271499,"Сборщик заказов (Москва, Коммунарка, Александры Монаховой, 30)",Перекрёсток,True,1503000.0,1632600.0,Москва
https://hh.ru/vacancy/107913072,"Сборщик заказов (Москва, Маршала Катукова, 25)",Перекрёсток,True,1395000.0,1611000.0,Москва
https://hh.ru/vacancy/108495371,"Сборщик заказов (Москва, 3-й Митинский, 3)",Перекрёсток,True,1278000.0,1465200.0,Москва
https://hh.ru/vacancy/107118911,Сборщик заказов (сотрудник супермаркета),Перекрёсток,False,,,Домодедово (Московская область)
https://hh.ru/vacancy/108845354,"Сборщик заказов (Набережные Челны, им Вахитова, 16А)",Перекрёсток,True,810000.0,954000.0,Набережные Челны
https://hh.ru/vacancy/109116649,"Сборщик заказов (Москва, Рязанский, 28)",Перекрёсток,True,1350000.0,1800000.0,Москва
https://hh.ru/vacancy/108495840,"Сборщик заказов (Ростов-на-Дону, Береговая, 6)",Перекрёсток,True,846000.0,984600.0,Ростов-на-Дону
https://hh.ru/vacancy/107912098,"Сборщик заказов (Санкт-Петербург, Большая Разночинная, 16)",Перекрёсток,True,1157400.0,1341000.0,Санкт-Петербург
https://hh.ru/vacancy/108596345,"Сборщик заказов (Москва, Дежнёва, 21)",Перекрёсток,True,1395000.0,1611000.0,Москва
https://hh.ru/vacancy/108845269,"Сборщик заказов (Москва, Дмитровское, 13)",Перекрёсток,True,1440000.0,2160000.0,Москва
https://hh.ru/vacancy/108845147,"Сборщик заказов (Санкт-Петербург, Выборгское, 33)",Перекрёсток,True,1157400.0,1341000.0,Санкт-Петербург
https://hh.ru/vacancy/108634666,Сборщик онлайн-заказов (график выходного дня),Перекрёсток,True,585000.0,990000.0,Дубна (Московская область)
https://hh.ru/vacancy/109212792,"Сборщик заказов (Москва, Туристская, 13)",Перекрёсток,True,1395000.0,1611000.0,Москва
https://hh.ru/vacancy/100105554,Сборщик заказов (сотрудник супермаркета),Перекрёсток,False,,,Люберцы  (Московская область)
https://hh.ru/vacancy/108596050,"Сборщик заказов (Санкт-Петербург, Подвойского, 37)",Перекрёсток,True,1157400.0,1341000.0,Санкт-Петербург
https://hh.ru/vacancy/100105558,Сборщик заказов (сотрудник супермаркета),Перекрёсток,False,,,Видное (Московская область)
https://hh.ru/vacancy/100105557,Сборщик заказов (сотрудник супермаркета),Перекрёсток,False,,,Московский (Московская область)
https://hh.ru/vacancy/109212710,"Сборщик заказов (Москва, Кантемировская, 6)",Перекрёсток,True,1395000.0,1611000.0,Москва
