URL,Employer,Name,Salary,From,To,City
https://hh.ru/vacancy/108546007,Сборщик онлайн-заказов (график выходного дня),Перекрёсток,True,639000.0,732600.0,Москва
https://hh.ru/vacancy/108545250,Сборщик онлайн-заказов (график выходного дня),Перекрёсток,True,639000.0,732600.0,Зеленоград
https://hh.ru/vacancy/108545331,Сборщик онлайн-заказов (график выходного дня),Перекрёсток,True,639000.0,732600.0,Мытищи (Московская область)
https://hh.ru/vacancy/107913486,"Сборщик заказов (Полевской, Зеленый Бор-1, 4А)",Перекрёсток,True,1027800.0,1195200.0,Полевской
https://hh.ru/vacancy/108545912,Сборщик онлайн-заказов (график выходного дня),Перекрёсток,True,639000.0,732600.0,Москва
https://hh.ru/vacancy/108931861,"Сборщик заказов (Лыткарино, Парковая, 2)",Перекрёсток,True,1260000.0,1350000.0,Лыткарино  (Московская область)
https://hh.ru/vacancy/108495336,"Сборщик заказов (Бор, Пушкина, 102)",Перекрёсток,True,916200.0,1085400.0,Бор
https://hh.ru/vacancy/109116584,"Сборщик заказов (Клин, Советская, 5)",Перекрёсток,True,990000.0,1224000.0,Клин (Московская область)
https://hh.ru/vacancy/108596372,"Сборщик заказов (Жуковский, Гагарина, 65/7)",Перекрёсток,True,1395000.0,1611000.0,Жуковский  (Московская область)
https://hh.ru/vacancy/107913302,"Сборщик заказов (Видное, Олимпийская, 6)",Перекрёсток,True,1395000.0,1611000.0,Видное (Московская область)
https://hh.ru/vacancy/108545461,Сборщик онлайн-заказов (график выходного дня),Перекрёсток,True,639000.0,732600.0,Щербинка (Московская область)
https://hh.ru/vacancy/108545308,Сборщик онлайн-заказов (график выходного дня),Перекрёсток,True,639000.0,732600.0,Московский (Московская область)
https://hh.ru/vacancy/109271856,"Сборщик заказов (Энгельс, Ленина, 4)",Перекрёсток,True,810000.0,1044000.0,Энгельс
https://hh.ru/vacancy/108596556,"Сборщик заказов (Екатеринбург, Петра Кожемяко, 16)",Перекрёсток,True,1062000.0,1229400.0,Екатеринбург
https://hh.ru/vacancy/108596667,"Сборщик заказов (Раменское, Вокзальная, 4б)",Перекрёсток,True,1395000.0,1611000.0,Раменское (Московская область)
https://hh.ru/vacancy/108545567,Сборщик онлайн-заказов (график выходного дня),Перекрёсток,True,639000.0,732600.0,Москва
https://hh.ru/vacancy/108166654,"Сборщик заказов (Уфа, Степана Кувыкина, 18)",Перекрёсток,True,972000.0,1141200.0,Уфа
https://hh.ru/vacancy/108596393,"Сборщик заказов (Москва, Домодедовская, 28)",Перекрёсток,True,1395000.0,1611000.0,Москва
https://hh.ru/vacancy/108596509,"Сборщик заказов (Волгоград, Ополченская, 38)",Перекрёсток,True,934200.0,1103400.0,Волгоград
https://hh.ru/vacancy/107911890,"Сборщик заказов (Старая Купавна, Акрихиновское, 12)",Перекрёсток,True,1395000.0,1611000.0,Старая Купавна (Московская область)
https://hh.ru/vacancy/108635889,Сборщик онлайн-заказов (график выходного дня),Перекрёсток,True,531000.0,614700.0,Екатеринбург
https://hh.ru/vacancy/108545961,Сборщик онлайн-заказов (график выходного дня),Перекрёсток,True,639000.0,732600.0,Москва
https://hh.ru/vacancy/108166600,"Сборщик заказов (Москва, Лермонтовский, 10)",Перекрёсток,True,1395000.0,1611000.0,Москва
https://hh.ru/vacancy/108496190,"Сборщик заказов (Ступино, Новое Ступино (село Верзилово), Петра Великого, 1)",Перекрёсток,True,1260000.0,1350000.0,Новое Ступино (Московская область)
https://hh.ru/vacancy/108545729,Сборщик онлайн-заказов (график выходного дня),Перекрёсток,True,639000.0,732600.0,Москва
https://hh.ru/vacancy/107911599,"Сборщик заказов (Истра, Покровское, Центральная, 14)",Перекрёсток,True,1395000.0,1611000.0,Покровское (городской округ Истра)
https://hh.ru/vacancy/108389714,"Сборщик заказов (Волгоград, им. Землячки, 110)",Перекрёсток,True,934200.0,1103400.0,Волгоград
https://hh.ru/vacancy/108495883,"Сборщик заказов (Тольятти, Революционная, 52А)",Перекрёсток,True,964800.0,1134000.0,Тольятти
https://hh.ru/vacancy/108496158,"Сборщик заказов (Москва, Байкальская, 12)",Перекрёсток,True,1395000.0,1611000.0,Москва
https://hh.ru/vacancy/109271926,"Сборщик заказов (Курск, Щепкина, 4Б)",Перекрёсток,True,810000.0,900000.0,Курск
https://hh.ru/vacancy/107912374,"Сборщик заказов (Екатеринбург, Сулимова, 50)",Перекрёсток,True,1062000.0,1229400.0,Екатеринбург
https://hh.ru/vacancy/107913275,"Сборщик заказов (Ступино, Победы, 63А)",Перекрёсток,True,1285200.0,1501200.0,Ступино (Московская область)
https://hh.ru/vacancy/107912273,"Сборщик заказов (Санкт-Петербург, Энгельса, 120)",Перекрёсток,True,1157400.0,1341000.0,Санкт-Петербург
https://hh.ru/vacancy/109116625,"Сборщик заказов (Раменское, Островцы, Подмосковная, 37)",Перекрёсток,True,810000.0,990000.0,Островцы (Московская область)
https://hh.ru/vacancy/108596549,"Сборщик заказов (Тюмень, Широтная, 112Б)",Перекрёсток,True,959400.0,1126800.0,Тюмень
https://hh.ru/vacancy/108390179,"Сборщик заказов (Санкт-Петербург, Бухарестская, 89)",Перекрёсток,True,1157400.0,1341000.0,Санкт-Петербург
https://hh.ru/vacancy/108032500,"Сборщик заказов (Санкт-Петербург, Пятилеток, 8)",Перекрёсток,True,1157400.0,1341000.0,Санкт-Петербург
https://hh.ru/vacancy/108389980,"Сборщик заказов (Зеленоград, , 1471Б)",Перекрёсток,True,1395000.0,1611000.0,Москва
https://hh.ru/vacancy/108596264,"Сборщик заказов (Троицк, Городская, 6)",Перекрёсток,True,1395000.0,1611000.0,Москва
https://hh.ru/vacancy/108219053,Сборщик заказов (комплектовщик),Перекрёсток,True,1278000.0,1458000.0,Нахабино (Московская область)
https://hh.ru/vacancy/108219054,Сборщик заказов (комплектовщик),Перекрёсток,True,1278000.0,1458000.0,Павловская Слобода (Московская область)
https://hh.ru/vacancy/104574755,Сборщик заказов (сотрудник супермаркета),Перекрёсток,True,844200.0,990000.0,Нижний Новгород
https://hh.ru/vacancy/109116659,"Сборщик заказов (Тула, Лейтейзена, 18)",Перекрёсток,True,360000.0,540000.0,Тула
https://hh.ru/vacancy/107913208,"Сборщик заказов (Химки, Дружбы, 1А)",Перекрёсток,True,1395000.0,1611000.0,Химки (Московская область)
https://hh.ru/vacancy/108324642,"Сборщик заказов (Балашиха, Кучино, Центральная, 68)",Перекрёсток,True,1395000.0,1611000.0,Балашиха (Московская область)
https://hh.ru/vacancy/107912438,"Сборщик заказов (Тверь, Цанова, 8)",Перекрёсток,True,1121400.0,1339200.0,Тверь
https://hh.ru/vacancy/108596548,"Сборщик заказов (Йошкар-Ола, Красноармейская, 111)",Перекрёсток,True,928800.0,1098000.0,Йошкар-Ола
https://hh.ru/vacancy/108324629,"Сборщик заказов (Москва, Рогозинино, Луговая, 20А)",Перекрёсток,True,1395000.0,1611000.0,Москва
https://hh.ru/vacancy/108718164,"Сборщик заказов (Заволжье, Железнодорожная, 18)",Перекрёсток,True,729000.0,768600.0,Заволжье
https://hh.ru/vacancy/108596149,"Сборщик заказов (Саратов, Соколовая, 18/40)",Перекрёсток,True,964800.0,1134000.0,Саратов
https://hh.ru/vacancy/108324744,"Сборщик заказов (Королёв, Королева, 6Г)",Перекрёсток,True,1395000.0,1611000.0,Королев (Московская область)
https://hh.ru/vacancy/108596530,"Сборщик заказов (Старый Оскол, Ленина, 22)",Перекрёсток,True,950400.0,1117800.0,Старый Оскол
https://hh.ru/vacancy/108324633,"Сборщик заказов (Москва, Новокосинская, 14)",Перекрёсток,True,1395000.0,1611000.0,Москва
https://hh.ru/vacancy/108634299,Сборщик онлайн-заказов (график выходного дня),Перекрёсток,True,439200.0,513000.0,Воронеж
https://hh.ru/vacancy/108596266,"Сборщик заказов (Москва, Петрозаводская, 24А)",Перекрёсток,True,1395000.0,1611000.0,Москва
https://hh.ru/vacancy/108495285,"Сборщик заказов (Таганрог, Бакинская, 65)",Перекрёсток,True,964800.0,1134000.0,Таганрог
https://hh.ru/vacancy/107912456,"Сборщик заказов (Москва, Аминьевское, 6)",Перекрёсток,True,1395000.0,1611000.0,Москва
https://hh.ru/vacancy/109442505,"Сборщик заказов (Нижневартовск, Чапаева, 27)",Перекрёсток,True,1166400.0,1335600.0,Нижневартовск
https://hh.ru/vacancy/108545401,Сборщик онлайн-заказов (график выходного дня),Перекрёсток,True,639000.0,732600.0,Химки (Московская область)
https://hh.ru/vacancy/108545261,Сборщик онлайн-заказов (график выходного дня),Перекрёсток,True,639000.0,732600.0,Люберцы  (Московская область)
https://hh.ru/vacancy/108545780,Сборщик онлайн-заказов (график выходного дня),Перекрёсток,True,639000.0,732600.0,Москва
https://hh.ru/vacancy/108324503,"Сборщик заказов (Одинцово, ВНИИССОК, Кленовая, 1)",Перекрёсток,True,1395000.0,1611000.0,Одинцово (Московская область)
https://hh.ru/vacancy/108495283,"Сборщик заказов (Тюмень, Западносибирская, 19)",Перекрёсток,True,959400.0,1126800.0,Тюмень
https://hh.ru/vacancy/108390160,"Сборщик заказов (Санкт-Петербург, Заневский, 67)",Перекрёсток,True,1157400.0,1341000.0,Санкт-Петербург
https://hh.ru/vacancy/109442740,"Сборщик заказов (Ивантеевка, Советский, 2А)",Перекрёсток,True,1395000.0,1611000.0,Ивантеевка (Московская область)
https://hh.ru/vacancy/109443422,"Сборщик заказов (Санкт-Петербург, Славянка, п Шушары, Ростовская, 20)",Перекрёсток,True,360000.0,540000.0,Санкт-Петербург
https://hh.ru/vacancy/108495522,"Сборщик заказов (Москва, Тихвинская, 17)",Перекрёсток,True,1395000.0,1611000.0,Москва
https://hh.ru/vacancy/108496101,"Сборщик заказов (Москва, Краснобогатырская, 90)",Перекрёсток,True,1395000.0,1611000.0,Москва
https://hh.ru/vacancy/108634476,Сборщик онлайн-заказов (график выходного дня),Перекрёсток,True,439200.0,513000.0,Воронеж
https://hh.ru/vacancy/107911737,"Сборщик заказов (Красногорск, Путилково, Спасо-Тушинский, 1)",Перекрёсток,True,1395000.0,1611000.0,Путилково (Московская область)
https://hh.ru/vacancy/107913466,"Сборщик заказов (Москва, Открытое, 4)",Перекрёсток,True,1395000.0,1611000.0,Москва
https://hh.ru/vacancy/108495938,"Сборщик заказов (Подольск, Советская, 20/44)",Перекрёсток,True,1395000.0,1611000.0,Подольск (Московская область)
https://hh.ru/vacancy/108596235,"Сборщик заказов (Ростов-на-Дону, Портовая, 456)",Перекрёсток,True,964800.0,1134000.0,Ростов-на-Дону
https://hh.ru/vacancy/108496179,"Сборщик заказов (Люберцы, Октябрьский, 146)",Перекрёсток,True,900000.0,1260000.0,Люберцы  (Московская область)
https://hh.ru/vacancy/108596221,"Сборщик заказов (Королёв, Горького, 79)",Перекрёсток,True,1395000.0,1611000.0,Королев (Московская область)
https://hh.ru/vacancy/108596296,"Сборщик заказов (Чебоксары, Мира, 82)",Перекрёсток,True,928800.0,1098000.0,Чебоксары
https://hh.ru/vacancy/107913543,"Сборщик заказов (Сургут, Профсоюзов, 11)",Перекрёсток,True,1166400.0,1335600.0,Сургут
https://hh.ru/vacancy/108595645,"Сборщик заказов (Пирогово, Пирогово, Высотная, 1Б)",Перекрёсток,True,853200.0,993600.0,Пирогово
https://hh.ru/vacancy/107911934,"Сборщик заказов (Москва, Шипиловская, 50)",Перекрёсток,True,1395000.0,1611000.0,Москва
https://hh.ru/vacancy/108389412,"Сборщик заказов (Уфа, Октября, 107а)",Перекрёсток,True,972000.0,1141200.0,Уфа
https://hh.ru/vacancy/108636229,Сборщик онлайн-заказов (график выходного дня),Перекрёсток,True,697500.0,805500.0,Красногорск (Московская область)
https://hh.ru/vacancy/108495917,"Сборщик заказов (Подольск, Ленинградская, 21)",Перекрёсток,True,1395000.0,1611000.0,Подольск (Московская область)
https://hh.ru/vacancy/108596603,"Сборщик заказов (Москва, Плещеева, 4)",Перекрёсток,True,990000.0,1260000.0,Москва
https://hh.ru/vacancy/107911825,"Сборщик заказов (Ступино, Горького, 26)",Перекрёсток,True,1285200.0,1501200.0,Ступино (Московская область)
https://hh.ru/vacancy/109271812,"Сборщик заказов (Санкт-Петербург, Ветеранов, 169)",Перекрёсток,True,720000.0,1260000.0,Санкт-Петербург
https://hh.ru/vacancy/109271624,"Сборщик заказов (Серпухов, Советская, 111)",Перекрёсток,True,1211400.0,1427400.0,Серпухов (Московская область)
https://hh.ru/vacancy/108496078,"Сборщик заказов (Тюмень, Ямская, 118)",Перекрёсток,True,959400.0,1126800.0,Тюмень
https://hh.ru/vacancy/108496143,Сборщик заказов (Совхоз имени Ленина),Перекрёсток,True,1170000.0,1530000.0,Посёлок совхоза имени Ленина (Московская область)
https://hh.ru/vacancy/108495770,"Сборщик заказов (Осиново, Осиново, Садовая, 9)",Перекрёсток,True,928800.0,1098000.0,Осиново
https://hh.ru/vacancy/108495818,"Сборщик заказов (Видное, Березовая, 8)",Перекрёсток,True,1395000.0,1611000.0,Видное (Московская область)
https://hh.ru/vacancy/108219060,Сборщик заказов (комплектовщик),Перекрёсток,True,1395000.0,1611000.0,Красногорск (Московская область)
https://hh.ru/vacancy/107912801,"Сборщик заказов (Бронницы, Каширский, 66)",Перекрёсток,True,1395000.0,1611000.0,Бронницы (Московская область)
https://hh.ru/vacancy/108495365,"Сборщик заказов (Балашиха, Железнодорожный, Рождественская, 3)",Перекрёсток,True,1395000.0,1611000.0,Железнодорожный  (Московская область)
https://hh.ru/vacancy/109271639,"Сборщик заказов (Ижевск, Славянское, 0/24)",Перекрёсток,True,810000.0,936000.0,Ижевск
https://hh.ru/vacancy/107911896,"Сборщик заказов (Москва, Большое Свинорье, Перспективная, 52)",Перекрёсток,True,1395000.0,1611000.0,Москва
https://hh.ru/vacancy/108495387,"Сборщик заказов (Кудрово, Европейский, 21)",Перекрёсток,True,1157400.0,1341000.0,Кудрово
https://hh.ru/vacancy/109116551,"Сборщик заказов (Киров, Горького, 5А)",Перекрёсток,True,810000.0,1170000.0,Киров (Кировская область)
https://hh.ru/vacancy/108495926,"Сборщик заказов (Домодедово, Северный, Краснодарская, 2)",Перекрёсток,True,1395000.0,1611000.0,Домодедово (Московская область)
https://hh.ru/vacancy/108596335,"Сборщик заказов (Нижний Новгород, Гагарина, 228)",Перекрёсток,True,928800.0,1098000.0,Нижний Новгород
https://hh.ru/vacancy/109270523,"Сборщик заказов (Новочеркасск, Платовский, 59)",Перекрёсток,True,846000.0,984600.0,Новочеркасск
https://hh.ru/vacancy/109470223,Сборщик онлайн-заказов (график выходного дня),Перекрёсток,True,639000.0,732600.0,Москва
https://hh.ru/vacancy/108166545,"Сборщик заказов (Владимир, Батурина, 20)",Перекрёсток,True,540000.0,900000.0,Владимир
https://hh.ru/vacancy/108496192,"Сборщик заказов (Краснодар, Гамбургская, 16)",Перекрёсток,True,964800.0,1134000.0,Краснодар
https://hh.ru/vacancy/108931868,"Сборщик заказов (Нижний Тагил, Фрунзе, 56)",Перекрёсток,True,540000.0,900000.0,Нижний Тагил
https://hh.ru/vacancy/109271596,"Сборщик заказов (Челябинск, Братьев Кашириных, 99А)",Перекрёсток,True,972000.0,1141200.0,Челябинск
https://hh.ru/vacancy/108032723,"Сборщик заказов (Мурино, Романовская, 1/31)",Перекрёсток,True,1060200.0,1220400.0,Мурино
https://hh.ru/vacancy/108717894,"Сборщик заказов (Гатчина, Пушкинское, 15)",Перекрёсток,True,1157400.0,1341000.0,Гатчина
https://hh.ru/vacancy/107912551,"Сборщик заказов (Санкт-Петербург, Уточкина, 4)",Перекрёсток,True,1157400.0,1341000.0,Санкт-Петербург
https://hh.ru/vacancy/109443282,"Сборщик заказов (Рязань, Пролетарская, 17)",Перекрёсток,True,630000.0,720000.0,Рязань
https://hh.ru/vacancy/107913082,"Сборщик заказов (Москва, Мичуринский, 31)",Перекрёсток,True,1395000.0,1611000.0,Москва
https://hh.ru/vacancy/108596302,"Сборщик заказов (Зеленоград, Панфиловский, 6А)",Перекрёсток,True,1395000.0,1611000.0,Москва
https://hh.ru/vacancy/108166378,"Сборщик заказов (Владимир, Октябрьский, 43)",Перекрёсток,True,1121400.0,1339200.0,Владимир
https://hh.ru/vacancy/107912114,"Сборщик заказов (Жуковский, Гагарина, 60А)",Перекрёсток,True,1395000.0,1611000.0,Жуковский  (Московская область)
https://hh.ru/vacancy/109473985,Сборщик онлайн-заказов,Перекрёсток,True,639000.0,732600.0,Москва
https://hh.ru/vacancy/108496185,"Сборщик заказов (Москва, Шоссейная, 34/36)",Перекрёсток,True,1395000.0,1611000.0,Москва
https://hh.ru/vacancy/108496021,"Сборщик заказов (Москва, Нижегородская, 2)",Перекрёсток,True,1395000.0,1611000.0,Москва
https://hh.ru/vacancy/109116607,"Сборщик заказов (Брянск, Дуки, 63)",Перекрёсток,True,720000.0,1080000.0,Брянск
https://hh.ru/vacancy/108495711,"Сборщик заказов (Дзержинск, Циолковского, 49)",Перекрёсток,True,916200.0,1085400.0,Дзержинск (Нижегородская область)
https://hh.ru/vacancy/109271019,"Сборщик заказов (Истра, Павловская Слобода, Ленина, 73)",Перекрёсток,True,1395000.0,1611000.0,Павловская Слобода (Московская область)
https://hh.ru/vacancy/109136615,Сборщик заказов,Перекрёсток,True,990000.0,1134000.0,Воронеж
https://hh.ru/vacancy/108596337,"Сборщик заказов (Домодедово, Северный, Каширское шоссе, 3А)",Перекрёсток,True,1395000.0,1611000.0,Домодедово (Московская область)
https://hh.ru/vacancy/107913615,"Сборщик заказов (Волгоград, Краснознаменская, 9)",Перекрёсток,True,934200.0,1103400.0,Волгоград
https://hh.ru/vacancy/107912284,"Сборщик заказов (Воронеж, Переверткина, 1)",Перекрёсток,True,964800.0,1134000.0,Воронеж
https://hh.ru/vacancy/108495756,"Сборщик заказов (Балашиха, Свердлова, 7)",Перекрёсток,True,1395000.0,1611000.0,Балашиха (Московская область)
https://hh.ru/vacancy/108634860,Сборщик онлайн-заказов (график выходного дня),Перекрёсток,True,531000.0,614700.0,Екатеринбург
https://hh.ru/vacancy/109475464,Сборщик онлайн-заказов (график выходного дня),Перекрёсток,True,639000.0,732600.0,Москва
https://hh.ru/vacancy/107912159,"Сборщик заказов (Санкт-Петербург, Просвещения, 60)",Перекрёсток,True,1157400.0,1341000.0,Санкт-Петербург
https://hh.ru/vacancy/107912364,"Сборщик заказов (Одинцово, Лесной Городок, Центральная, 8)",Перекрёсток,True,1395000.0,1611000.0,Одинцово (Московская область)
https://hh.ru/vacancy/107913636,"Сборщик заказов (Сергиев Посад, Вознесенская, 32А)",Перекрёсток,True,1211400.0,1427400.0,Сергиев Посад (Московская область)
https://hh.ru/vacancy/108495735,"Сборщик заказов (Уфа, Верхнеторговая, 1)",Перекрёсток,True,972000.0,1141200.0,Уфа
https://hh.ru/vacancy/108596448,"Сборщик заказов (Москва, Ленинский, 99)",Перекрёсток,True,1395000.0,1611000.0,Москва
https://hh.ru/vacancy/108389964,"Сборщик заказов (Москва, Карамышевская, 2А)",Перекрёсток,True,1395000.0,1611000.0,Москва
https://hh.ru/vacancy/109442935,"Сборщик заказов (Великий Новгород, Ломоносова, 29)",Перекрёсток,True,993600.0,1177200.0,Великий Новгород
https://hh.ru/vacancy/107913622,"Сборщик заказов (Сочи, Гастелло, 27Б)",Перекрёсток,True,1330200.0,1531800.0,Сочи
https://hh.ru/vacancy/108931798,"Сборщик заказов (Санкт-Петербург, Пражская, 48/50)",Перекрёсток,True,1157400.0,1341000.0,Санкт-Петербург
https://hh.ru/vacancy/107912299,"Сборщик заказов (Санкт-Петербург, Гражданский, 41)",Перекрёсток,True,1157400.0,1341000.0,Санкт-Петербург
